{
  "$schema": "https://json-schema.org/draft/2020-12/schema",
  "title": "QIP activities seed",
  "type": "object",
  "required": [
    "version",
    "activities"
  ],
  "properties": {
    "version": {
      "type": "string"
    },
    "groupProtocol": {
      "type": "string"
    },
    "groupLabels": {
      "type": "array",
      "items": {
        "type": "string",
        "maxLength": 40
      }
    },
    "activities": {
      "type": "array",
      "items": {
        "$ref": "#/$defs/activity"
      }
    }
  },
  "$defs": {
    "reflection": {
      "type": "object",
      "required": [
        "id",
        "prompt"
      ],
      "properties": {
        "id": {
          "type": "string"
        },
        "prompt": {
          "type": "string"
        },
        "maxChars": {
          "type": "integer",
          "minimum": 50,
          "maximum": 5000
        }
      }
    },
    "item": {
      "type": "object",
      "required": [
        "id",
        "text"
      ],
      "properties": {
        "id": {
          "type": "string"
        },
        "text": {
          "type": "string"
        }
      }
    },
    "activity": {
      "type": "object",
      "required": [
        "activityId",
        "sessionId",
        "order",
        "title",
        "widgetType",
        "config",
        "sourceRef",
        "groupMode",
        "derived",
        "confidential"
      ],
      "properties": {
        "activityId": {
          "type": "string",
          "pattern": "^d[1-3]s[1-4]_a[0-9]+_[a-z0-9_]+$"
        },
        "sessionId": {
          "type": "string",
          "pattern": "^d[1-3]s[1-4]$"
        },
        "order": {
          "type": "integer",
          "minimum": 1
        },
        "title": {
          "type": "string",
          "minLength": 3
        },
        "instructions": {
          "type": "string"
        },
        "widgetType": {
          "enum": [
            "rating_scale",
            "choice_matrix",
            "rank_order",
            "checklist",
            "table_entry",
            "fixed_grid",
            "crm_matrix",
            "free_text",
            "working_doc",
            "poll",
            "ladder_game",
            "composite"
          ]
        },
        "config": {
          "type": "object"
        },
        "sourceRef": {
          "type": "string"
        },
        "groupMode": {
          "enum": [
            "individual",
            "group"
          ]
        },
        "groupSetup": {
          "type": "string"
        },
        "confidential": {
          "type": "boolean"
        },
        "derived": {
          "type": "boolean"
        },
        "timeLimitMin": {
          "type": "integer",
          "minimum": 1,
          "maximum": 120
        },
        "carryForward": {
          "type": "object",
          "properties": {
            "readKeys": {
              "type": "array",
              "items": {
                "type": "string"
              }
            },
            "writeKeys": {
              "type": "array",
              "items": {
                "type": "string"
              }
            },
            "writeFrom": {
              "type": "object",
              "additionalProperties": {
                "type": "string"
              }
            }
          },
          "additionalProperties": false
        },
        "scoring": {
          "type": "object",
          "required": [
            "method"
          ],
          "properties": {
            "method": {
              "enum": [
                "sum"
              ]
            },
            "max": {
              "type": "integer"
            },
            "bands": {
              "type": "array",
              "items": {
                "type": "object",
                "required": [
                  "min",
                  "max",
                  "label"
                ]
              }
            }
          }
        }
      },
      "additionalProperties": false
    }
  }
}