{
  "version": "1.1",
  "groupProtocol": "GROUP ACTIVITY - 1) Sit with your group as directed by the facilitator. 2) Select your group number from the list; every member of the group must select the SAME number. 3) Discuss and agree. 4) Each member records the answers in their OWN response and submits. The HoD sees the responses grouped by group number. Where the instructions say 'your own course', record your own course, not the group's.",
  "groupLabels": [
    "Group 1",
    "Group 2",
    "Group 3",
    "Group 4",
    "Group 5",
    "Group 6",
    "Group 7",
    "Group 8",
    "Group 9",
    "Group 10",
    "Group 11",
    "Group 12",
    "Group 13",
    "Group 14",
    "Group 15",
    "Group 16",
    "Group 17",
    "Group 18",
    "Group 19",
    "Group 20"
  ],
  "activities": [
    {
      "activityId": "d1s1_a1_four_pillars",
      "sessionId": "d1s1",
      "order": 1,
      "title": "The Four Pillars: Where Do We Stand?",
      "instructions": "T-shaped learning is the destination. Academic rigour is the depth. Higher-order thinking is the cognitive engine. SoTL is the improvement mechanism.",
      "widgetType": "composite",
      "config": {
        "parts": [
          {
            "id": "p1",
            "widgetType": "poll",
            "config": {
              "questions": [
                {
                  "id": "q1",
                  "prompt": "Which of the four pillars is currently the WEAKEST in our department?",
                  "multi": false,
                  "options": [
                    {
                      "id": "o1",
                      "text": "T-shaped learning - the destination"
                    },
                    {
                      "id": "o2",
                      "text": "Academic rigour - the depth"
                    },
                    {
                      "id": "o3",
                      "text": "Higher-order thinking - the cognitive engine"
                    },
                    {
                      "id": "o4",
                      "text": "Scholarship of Teaching and Learning (SoTL) - the improvement mechanism"
                    }
                  ]
                }
              ]
            }
          },
          {
            "id": "p2",
            "widgetType": "free_text",
            "config": {
              "questions": [
                {
                  "id": "q2",
                  "prompt": "Why did you choose this pillar? Give one example from your own teaching.",
                  "maxChars": 1500
                }
              ]
            }
          }
        ]
      },
      "sourceRef": "HoD_circle_-_4_concept_note_and_schedule.pdf - Concept Note, four interconnected ideas",
      "groupMode": "individual",
      "derived": false,
      "confidential": false
    },
    {
      "activityId": "d1s1_a2_tl_questionnaire",
      "sessionId": "d1s1",
      "order": 2,
      "title": "Contemporary Teaching and Learning Assessment Questionnaire",
      "instructions": "Rate each statement about our department as you experience it, on a scale of 1-5. 'Faculty' means faculty in our department, including you. CONFIDENTIAL: your HoD, Dean, Associate Dean and HRDC see only department averages (shown once at least 5 colleagues have responded) and written comments without names. They can see THAT you have submitted, but not your individual ratings. Individual responses are accessible only to the App Admin, who generates the department summary.",
      "widgetType": "rating_scale",
      "config": {
        "scale": {
          "min": 1,
          "max": 5,
          "labels": [
            "Strongly Disagree",
            "Disagree",
            "Neutral",
            "Agree",
            "Strongly Agree"
          ]
        },
        "sections": [
          {
            "id": "A",
            "title": "A. Student-Centred Teaching and Learning",
            "items": [
              {
                "id": "a1",
                "text": "Faculty regularly use active learning strategies in classrooms."
              },
              {
                "id": "a2",
                "text": "Students are encouraged to participate, discuss, and collaborate during learning activities."
              },
              {
                "id": "a3",
                "text": "Teaching approaches promote critical thinking and problem-solving."
              },
              {
                "id": "a4",
                "text": "Experiential learning opportunities are integrated into courses."
              }
            ]
          },
          {
            "id": "B",
            "title": "B. Curriculum and Learning Design",
            "items": [
              {
                "id": "b1",
                "text": "The curriculum is regularly updated to reflect current developments in the discipline."
              },
              {
                "id": "b2",
                "text": "Courses are aligned with clearly defined learning outcomes."
              },
              {
                "id": "b3",
                "text": "Interdisciplinary and multidisciplinary learning opportunities are available."
              },
              {
                "id": "b4",
                "text": "Industry and societal needs are reflected in curriculum design."
              }
            ]
          },
          {
            "id": "C",
            "title": "C. Assessment and Feedback",
            "items": [
              {
                "id": "c1",
                "text": "Assessments measure higher-order thinking and application of knowledge."
              },
              {
                "id": "c2",
                "text": "Students receive timely and constructive feedback."
              },
              {
                "id": "c3",
                "text": "Multiple assessment methods are used to evaluate learning."
              },
              {
                "id": "c4",
                "text": "Assessment practices support continuous learning and improvement."
              }
            ]
          },
          {
            "id": "D",
            "title": "D. Technology and AI Integration",
            "items": [
              {
                "id": "d1",
                "text": "Digital technologies are effectively integrated into teaching and learning."
              },
              {
                "id": "d2",
                "text": "Faculty use learning management systems and digital resources effectively."
              },
              {
                "id": "d3",
                "text": "Students are guided on the ethical use of Artificial Intelligence tools."
              },
              {
                "id": "d4",
                "text": "AI is being explored to enhance teaching, learning, and assessment practices."
              }
            ]
          },
          {
            "id": "E",
            "title": "E. Student Engagement and Success",
            "items": [
              {
                "id": "e1",
                "text": "Students actively engage in classroom and co-curricular learning activities."
              },
              {
                "id": "e2",
                "text": "Mechanisms exist to identify and support struggling students."
              },
              {
                "id": "e3",
                "text": "Student feedback is regularly collected and acted upon."
              },
              {
                "id": "e4",
                "text": "The department promotes a culture of belonging and inclusivity."
              }
            ]
          },
          {
            "id": "F",
            "title": "F. Research and Innovation in Learning",
            "items": [
              {
                "id": "f1",
                "text": "Research-based learning is integrated into courses."
              },
              {
                "id": "f2",
                "text": "Students are encouraged to undertake research projects and inquiry-based assignments."
              },
              {
                "id": "f3",
                "text": "Faculty regularly innovate and experiment with teaching practices."
              },
              {
                "id": "f4",
                "text": "The department promotes creativity, innovation, and entrepreneurship."
              }
            ]
          },
          {
            "id": "G",
            "title": "G. Faculty Development and Learning Culture",
            "items": [
              {
                "id": "g1",
                "text": "Faculty participate regularly in professional development programmes."
              },
              {
                "id": "g2",
                "text": "Peer learning and sharing of best teaching practices are encouraged."
              },
              {
                "id": "g3",
                "text": "Teaching excellence is recognized and rewarded."
              },
              {
                "id": "g4",
                "text": "The department actively supports continuous improvement in teaching quality."
              }
            ]
          },
          {
            "id": "H",
            "title": "H. Quality Assurance and Continuous Improvement",
            "items": [
              {
                "id": "h1",
                "text": "Learning outcomes are systematically monitored and evaluated."
              },
              {
                "id": "h2",
                "text": "Data and evidence are used to improve teaching and learning practices."
              },
              {
                "id": "h3",
                "text": "The department regularly reviews its teaching-learning processes."
              },
              {
                "id": "h4",
                "text": "Quality enhancement initiatives are implemented based on identified needs."
              }
            ]
          }
        ],